{
  "schema_version": 1,
  "paper_id": "paper_1",
  "context_id": "proof",
  "imports": [
    "dataset.paper_1.formalisation.Context"
  ],
  "files": [
    "dataset/paper_1/formalisation/Context.lean"
  ],
  "closure": {
    "algorithm": "sha256_length_prefixed_paths_and_contents_v1",
    "sha256": "13b2981a3d881a1b69a1e9f41920e1306440a66477235e484c850d443c04ea97"
  }
}
